,Unnamed: 0,Unnamed: 0.1,Unnamed: 0.1.1,Text,Date,Favorites,Retweets,Tweet ID,sentiment,pos_pct,neg_pct
0,0,0,0,Donald Trump is a cry baby.,2017-03-03 14:54:18,4,0,837798314691145730,"{'neg': 0.437, 'neu': 0.563, 'pos': 0.0, 'compound': -0.4767}",0.075375,0.072
1,1,1,1,"JESUS SAYS... There is a Traitor among Donald Trump's staff  From February 26th, 2017 .@realDonaldTrump .@POTUShttps://youtu.be/usPQJcbaNvA ",2017-03-03 13:53:16,0,0,837782956341137409,"{'neg': 0.0, 'neu': 1.0, 'pos': 0.0, 'compound': 0.0}",0.075375,0.072
2,2,2,2,"The OTHER envelope, please! People LICK their video games, is anyone better than #DonaldTrump?  Also, hypnotherapy, #Oprah2020, and more!https://twitter.com/JoeAguiar_1059/status/837721941742088192 …",2017-03-03 10:25:11,1,0,837730588853420032,"{'neg': 0.0, 'neu': 0.746, 'pos': 0.254, 'compound': 0.6988}",0.075375,0.072
3,3,3,3,An #Oscars Recap & Is #DonaldTrump really the Best at Everything? @SethBlairRadio & author @DrNancyIrwin join me!http://bit.ly/2lHXJJF ,2017-03-03 09:50:49,0,0,837721941742088192,"{'neg': 0.0, 'neu': 0.651, 'pos': 0.349, 'compound': 0.7888}",0.075375,0.072
4,4,4,4,Donald Trump has done the impossible: Reversed India's decades-old preference for US-based grooms https://amp-scroll-in.cdn.ampproject.org/c/s/amp.scroll.in/article/830653/donald-trump-has-done-the-impossible-reversed-indias-decades-old-preference-for-us-based-grooms …,2017-03-03 04:21:37,0,0,837639093697785858,"{'neg': 0.0, 'neu': 1.0, 'pos': 0.0, 'compound': 0.0}",0.075375,0.072
5,5,5,5,Just by having lots of thoughts I completely understand on what Donald Trump is saying in his tweets,2017-03-02 23:59:15,0,0,837573070227456000,"{'neg': 0.0, 'neu': 1.0, 'pos': 0.0, 'compound': 0.0}",0.075375,0.072
6,6,6,6,Vietnam absentee Donald Trump's military look raises eyebrows: * President donned bomber jackets… http://m.tbnn.it/NWyy9d  | #Election2016,2017-03-02 23:42:12,0,0,837568777155850241,"{'neg': 0.139, 'neu': 0.861, 'pos': 0.0, 'compound': -0.2732}",0.075375,0.072
7,7,7,7,Investigate Donald Trump http://petitions.moveon.org/s/IoIBew  @moveon,2017-03-02 22:52:44,0,0,837556330067963904,"{'neg': 0.0, 'neu': 1.0, 'pos': 0.0, 'compound': 0.0}",0.075375,0.072
