,Unnamed: 0,Unnamed: 0.1,Unnamed: 0.1.1,Text,Date,Favorites,Retweets,Tweet ID,sentiment,pos_pct,neg_pct
0,0,0,0,"@AyoRileyG I'm ""Fix your eyebrows Donald Trump""",2017-03-01 15:11:11,1,0,837077788591009793,"{'neg': 0.0, 'neu': 1.0, 'pos': 0.0, 'compound': 0.0}",0.0695555555556,0.024
1,1,1,1,The State of Disunion: Donald Trump’s dystopian America. http://m.tbnn.it/NWJ43M ,2017-03-01 12:36:11,0,0,837038779395276801,"{'neg': 0.0, 'neu': 1.0, 'pos': 0.0, 'compound': 0.0}",0.0695555555556,0.024
2,2,2,2,@ConstanceQueen8 Last night we watched God heal her and He used Donald Trump to heal her.,2017-03-01 10:40:44,0,0,837009726001065984,"{'neg': 0.0, 'neu': 0.877, 'pos': 0.123, 'compound': 0.2732}",0.0695555555556,0.024
3,3,3,3,Donald Trump’s opportunity to re-make the Federal Reserve: The following is about Mr. Trump in only one respect: He… http://m.tbnn.it/NWFNnK ,2017-03-01 10:18:14,0,0,837004065124954112,"{'neg': 0.0, 'neu': 0.753, 'pos': 0.247, 'compound': 0.7096}",0.0695555555556,0.024
4,4,4,4,"With One Terrific Speech, Donald Trump Becomes President Trump http://www.investors.com/politics/editorials/with-one-great-speech-donald-trump-becomes-president-trump/ …",2017-03-01 09:38:28,0,0,836994058413309952,"{'neg': 0.0, 'neu': 0.744, 'pos': 0.256, 'compound': 0.4767}",0.0695555555556,0.024
5,5,5,5,Dem Senator: Donald Trump Was 'Childish' To Ignore Climate Change In His Big Speech: Democrats… http://m.tbnn.it/NWCQks  | @HuffingtonPost,2017-03-01 08:43:54,0,0,836980324047298561,"{'neg': 0.135, 'neu': 0.865, 'pos': 0.0, 'compound': -0.3612}",0.0695555555556,0.024
6,6,6,6,Almost every big claim Donald Trump just made was false http://www.independent.co.uk/news/world/americas/us-politics/donald-trump-speech-fact-check-lies-claims-joint-address-congress-jobs-immigration-pipeline-a7604861.html …,2017-03-01 08:11:29,2,1,836972165924810754,"{'neg': 0.0, 'neu': 1.0, 'pos': 0.0, 'compound': 0.0}",0.0695555555556,0.024
7,7,7,7,"Con letras grandes y sus dibujos de colores, los niños expresaron lo que sienten hacia el presidente Donald Trump... http://fb.me/8B5XhTrrX ",2017-03-01 08:00:26,0,0,836969387777220613,"{'neg': 0.0, 'neu': 1.0, 'pos': 0.0, 'compound': 0.0}",0.0695555555556,0.024
8,8,8,8,"#CNN Chief #JeffZucker Unveils Plan to Dominate Digital: New Shows, a $25M YouTuber and Donald Trump (Of Course):… http://j.mp/2m8vBCu ",2017-03-01 07:13:24,0,0,836957548473245696,"{'neg': 0.081, 'neu': 0.919, 'pos': 0.0, 'compound': -0.128}",0.0695555555556,0.024
